{
  "stage": "intent-to-implementation",
  "generatedAt": "2026-06-09",
  "sourceIntentGraphPath": "design/KG/SystemArchitecture.json",
  "summary": "Intent clarification for the full explicit security gate: all declared explicit acceptance testcases must pass without weakening frozen entrypoints. sec-e2e-025 remains governed by whole-ledger tamper detection, and the remaining sec-e2e-027 failure is a lease-recovery release gap: after a lease-expired canonical client proves the full missing gap to the cloud mirror, Security Center must close recovery_required, project ALIGNED or TRUSTED for that same client, and normal model access must return; keeping UNTRUSTED or 423 after valid proof is not an acceptable secure state.",
  "intentElementIds": [
    "intent-qwenpaw-platform",
    "intent-backend-runtime",
    "intent-local-operator-cli",
    "intent-local-security-audit-foundation",
    "intent-high-risk-tool-guard",
    "intent-audit-event",
    "intent-audit-checkpoint-anchor",
    "intent-audit-uplink-manager",
    "intent-heartbeat-emitter",
    "intent-security-center",
    "intent-audit-lease-monitor",
    "intent-cloud-integrity-stub"
  ],
  "relationshipIds": [
    "rel-platform-backend",
    "rel-platform-cli",
    "rel-cli-backend",
    "rel-backend-security-audit-foundation",
    "rel-audit-foundation-high-risk-tool-guard",
    "rel-audit-foundation-audit-event",
    "rel-audit-foundation-checkpoint-anchor",
    "rel-uplink-manager-foundation",
    "rel-uplink-manager-heartbeat-emitter",
    "rel-heartbeat-emitter-security-center",
    "rel-uplink-service-security-center",
    "rel-security-center-lease-monitor",
    "rel-lease-monitor-cloud-stub",
    "rel-security-center-cloud-stub",
    "rel-uplink-manager-cloud-stub"
  ],
  "explicitTestcases": [
    {
      "name": "cli-version-surface",
      "mountedElementId": "intent-local-operator-cli",
      "mountedElementName": "Local Operator CLI",
      "type": "Unit Test",
      "controlPoint": "Run tests/unit/cli/test_cli_version.py::test_cli_version_option_outputs_current_version.",
      "observationPoint": "The packaged local operator CLI exposes the current QwenPaw version without crashing or bypassing the CLI entrypoint.",
      "acceptanceBoundary": "tests/unit/cli/test_cli_version.py::test_cli_version_option_outputs_current_version must pass as part of the full explicit-test gate.",
      "requiredEntryKind": "explicit-testcase-entry",
      "implementationNotes": "Treat failure as CLI/runtime implementation drift; do not loosen the expected version surface."
    },
    {
      "name": "agents-list-surface",
      "mountedElementId": "intent-local-operator-cli",
      "mountedElementName": "Local Operator CLI",
      "type": "Unit Test",
      "controlPoint": "Run tests/unit/cli/test_cli_agents.py::test_agents_list_uses_shared_tool_helper.",
      "observationPoint": "The agents list command routes through the shared tool helper expected by the CLI contract.",
      "acceptanceBoundary": "tests/unit/cli/test_cli_agents.py::test_agents_list_uses_shared_tool_helper must pass as part of the full explicit-test gate.",
      "requiredEntryKind": "explicit-testcase-entry",
      "implementationNotes": "Treat failure as command/helper wiring drift; do not replace the shared-helper assertion with a weaker smoke check."
    },
    {
      "name": "task-help-surface",
      "mountedElementId": "intent-local-operator-cli",
      "mountedElementName": "Local Operator CLI",
      "type": "Unit Test",
      "controlPoint": "Run tests/unit/cli/test_cli_task.py::test_task_command_registered_in_cli.",
      "observationPoint": "The task command remains registered in the qwenpaw CLI surface.",
      "acceptanceBoundary": "tests/unit/cli/test_cli_task.py::test_task_command_registered_in_cli must pass as part of the full explicit-test gate.",
      "requiredEntryKind": "explicit-testcase-entry",
      "implementationNotes": "Treat failure as command registration drift; do not remove this entrypoint from the explicit baseline without upstream architecture redesign."
    },
    {
      "name": "settings-language-roundtrip",
      "mountedElementId": "intent-backend-runtime",
      "mountedElementName": "Backend Runtime",
      "type": "Unit Test",
      "controlPoint": "Run tests/unit/routers/test_settings.py::test_put_then_get_roundtrip.",
      "observationPoint": "A settings update can be read back through the backend router with the expected roundtrip semantics.",
      "acceptanceBoundary": "tests/unit/routers/test_settings.py::test_put_then_get_roundtrip must pass as part of the full explicit-test gate.",
      "requiredEntryKind": "explicit-testcase-entry",
      "implementationNotes": "Treat failure as backend settings contract drift; do not mask persistence or serialization defects by weakening the roundtrip assertion."
    },
    {
      "name": "git-helper-command-runner",
      "mountedElementId": "intent-backend-runtime",
      "mountedElementName": "Backend Runtime",
      "type": "Unit Test",
      "controlPoint": "Run tests/unit/routers/test_git.py::test_git_helper_uses_shared_command_runner.",
      "observationPoint": "The git helper uses the shared command runner instead of a divergent command execution path.",
      "acceptanceBoundary": "tests/unit/routers/test_git.py::test_git_helper_uses_shared_command_runner must pass as part of the full explicit-test gate.",
      "requiredEntryKind": "explicit-testcase-entry",
      "implementationNotes": "Treat failure as backend helper boundary drift; do not bypass the shared command-runner contract to make the test pass."
    },
    {
      "name": "sec-e2e-024-end-to-end-non-repudiation-evidence-chain",
      "mountedElementId": "intent-local-security-audit-foundation",
      "mountedElementName": "Local Security Audit Foundation",
      "type": "Acceptance Test",
      "controlPoint": "Run tests/integration/security/test_audit_foundation.py::test_end_to_end_non_repudiation_evidence_chain against the real app_server fixture: authenticate user A, delegate a high-risk action through agent/plugin/tool seams, and provide required user confirmation.",
      "observationPoint": "Security Center and the audit query surface expose a continuous user -> agent -> plugin -> tool evidence chain with a durable confirmation artifact digest and no anonymous or fallback-system identity link.",
      "acceptanceBoundary": "tests/integration/security/test_audit_foundation.py::test_end_to_end_non_repudiation_evidence_chain must pass as part of the full explicit-test gate.",
      "requiredEntryKind": "explicit-testcase-entry",
      "implementationNotes": "The test body and protected harness vocabulary are frozen; fix production security/audit behavior beneath the harness."
    },
    {
      "name": "sec-e2e-025-audit-integrity-self-healing-lockdown",
      "mountedElementId": "intent-local-security-audit-foundation",
      "mountedElementName": "Local Security Audit Foundation",
      "type": "Acceptance Test",
      "controlPoint": "Run tests/integration/security/test_audit_foundation.py::test_audit_integrity_self_healing_lockdown against the real app_server fixture: execute multiple high-risk actions to create a multi-record audit baseline and cloud anchor, edit a committed local audit record by operating-system means, including the second/non-tail record while leaving later records possible, then attempt another high-risk action without manual trust recovery.",
      "observationPoint": "The system raises one business-level data-continuity anomaly, enters local UNTRUSTED lock mode before releasing the next high-risk tool, refuses sensitive tooling, and exposes recovery_required/UNTRUSTED through the frozen Security Center backend plus operator-web observation surfaces; Security Center must not show CLEAR until full-chain validation against the cloud mirror succeeds.",
      "acceptanceBoundary": "tests/integration/security/test_audit_foundation.py::test_audit_integrity_self_healing_lockdown must pass as part of the full explicit-test gate.",
      "requiredEntryKind": "explicit-testcase-entry",
      "implementationNotes": "Implementation Design must review whether the frozen acceptance body and harness already cover historical-record edit tamper. If they only cover checkpoint loss or tail truncation, update the implementation architecture and explicit acceptance design so this branch is observable before Coding/Repair. Do not treat a locally self-consistent rewritten chain or unchanged checkpoint as CLEAR without cloud-mirror validation."
    },
    {
      "name": "sec-e2e-027-lease-expiry-active-defense",
      "mountedElementId": "intent-local-security-audit-foundation",
      "mountedElementName": "Local Security Audit Foundation",
      "type": "Acceptance Test",
      "controlPoint": "Run tests/integration/security/test_audit_foundation.py::test_lease_expiry_blocks_untrusted_rejoin_until_gap_sync against the real app_server fixture: allow a trusted client to miss the lease window, observe denied rejoin before missing-gap verification, then drive the distinct recovery control point and restored-access attempt.",
      "observationPoint": "Security Center marks the same canonical client UNTRUSTED after lease expiry, pre_recovery_console_status shows denied rejoin before proof, the recovery control point accepts full missing-gap validation, post_recovery_console_status becomes 200 only after that validation, post-recovery trust projects ALIGNED or TRUSTED with recovery_required=false, and continued UNTRUSTED or 423 after valid proof is a failure.",
      "acceptanceBoundary": "tests/integration/security/test_audit_foundation.py::test_lease_expiry_blocks_untrusted_rejoin_until_gap_sync must pass as part of the full explicit-test gate.",
      "requiredEntryKind": "explicit-testcase-entry",